22:42:21.418955 IP 142.93.118.186.54924 > 67.207.67.2.domain: 24106+ A? facebook.com. (30)
22:42:21.419402 IP 67.207.67.2.domain > 142.93.118.186.54924: 24106 1/0/0 A 31.13.71.36 (46)
22:42:21.421259 IP 142.93.118.186.42403 > 67.207.67.2.domain: 57054+ A? whois.verisign-grs.com. (40)
22:42:21.421275 IP 142.93.118.186.42403 > 67.207.67.2.domain: 37457+ AAAA? whois.verisign-grs.com. (40)
22:42:21.421743 IP 67.207.67.2.domain > 142.93.118.186.42403: 57054 2/0/0 A 192.34.234.30, A 192.30.45.30 (72)
22:42:21.421824 IP 67.207.67.2.domain > 142.93.118.186.42403: 37457 2/0/0 AAAA 2620:74:20::30, AAAA 2620:74:21::30 (96)
22:42:21.421921 IP 142.93.118.186.36176 > whois-2.verisign-grs.com.whois: Flags [S], seq 2330846790, win 29200, options [mss 1460,sackOK,TS val 475653344 ecr 0,nop,wscale 7], length 0
22:42:21.443400 IP whois-2.verisign-grs.com.whois > 142.93.118.186.36176: Flags [S.], seq 2756751800, ack 2330846791, win 13480, options [mss 1360,sackOK,TS val 2260313777 ecr 475653344,nop,wscale 7], length 0
22:42:21.443454 IP 142.93.118.186.36176 > whois-2.verisign-grs.com.whois: Flags [.], ack 1, win 229, options [nop,nop,TS val 475653349 ecr 2260313777], length 0
22:42:21.443532 IP 142.93.118.186.36176 > whois-2.verisign-grs.com.whois: Flags [P.], seq 1:14, ack 1, win 229, options [nop,nop,TS val 475653349 ecr 2260313777], length 13
22:42:21.448229 IP 104.248.224.85.33794 > 142.93.118.186.2749: Flags [S], seq 713670068, win 29200, options [mss 1460,sackOK,TS val 2074056 ecr 0,nop,wscale 7], length 0
22:42:21.448279 IP 142.93.118.186.2749 > 104.248.224.85.33794: Flags [S.], seq 4054690318, ack 713670069, win 28960, options [mss 1460,sackOK,TS val 475653350 ecr 2074056,nop,wscale 7], length 0
22:42:21.448980 IP 104.248.224.85.33794 > 142.93.118.186.2749: Flags [.], ack 1, win 229, options [nop,nop,TS val 2074057 ecr 475653350], length 0
22:42:21.449283 IP 142.93.118.186.2749 > 104.248.224.85.33794: Flags [P.], seq 1:26, ack 1, win 227, options [nop,nop,TS val 475653350 ecr 2074057], length 25
22:42:21.449583 IP 104.248.224.85.33794 > 142.93.118.186.2749: Flags [.], ack 26, win 229, options [nop,nop,TS val 2074057 ecr 475653350], length 0
22:42:21.464514 IP whois-2.verisign-grs.com.whois > 142.93.118.186.36176: Flags [.], ack 14, win 106, options [nop,nop,TS val 2260313798 ecr 475653349], length 0
22:42:21.465150 IP whois-2.verisign-grs.com.whois > 142.93.118.186.36176: Flags [P.], seq 1:3240, ack 14, win 106, options [nop,nop,TS val 2260313799 ecr 475653349], length 3239
22:42:21.465176 IP whois-2.verisign-grs.com.whois > 142.93.118.186.36176: Flags [F.], seq 3240, ack 14, win 106, options [nop,nop,TS val 2260313799 ecr 475653349], length 0
22:42:21.465206 IP 142.93.118.186.36176 > whois-2.verisign-grs.com.whois: Flags [.], ack 3240, win 279, options [nop,nop,TS val 475653354 ecr 2260313799], length 0
22:42:21.465291 IP 142.93.118.186.36176 > whois-2.verisign-grs.com.whois: Flags [F.], seq 14, ack 3241, win 279, options [nop,nop,TS val 475653354 ecr 2260313799], length 0
22:42:21.486247 IP whois-2.verisign-grs.com.whois > 142.93.118.186.36176: Flags [.], ack 15, win 106, options [nop,nop,TS val 2260313820 ecr 475653354], length 0
22:42:24.847756 IP 104.248.224.85.33794 > 142.93.118.186.2749: Flags [P.], seq 1:10, ack 26, win 229, options [nop,nop,TS val 2074906 ecr 475653350], length 9
22:42:24.847804 IP 142.93.118.186.2749 > 104.248.224.85.33794: Flags [.], ack 10, win 227, options [nop,nop,TS val 475654200 ecr 2074906], length 0
22:42:24.847958 IP 142.93.118.186.2749 > 104.248.224.85.33794: Flags [P.], seq 26:65, ack 10, win 227, options [nop,nop,TS val 475654200 ecr 2074906], length 39
22:42:24.848189 IP 104.248.224.85.33794 > 142.93.118.186.2749: Flags [.], ack 65, win 229, options [nop,nop,TS val 2074906 ecr 475654200], length 0
22:42:26.296102 IP 206.189.113.189.53878 > 142.93.118.186.2749: Flags [S], seq 1326303986, win 29200, options [mss 1460,sackOK,TS val 2059461 ecr 0,nop,wscale 7], length 0
22:42:26.296155 IP 142.93.118.186.2749 > 206.189.113.189.53878: Flags [S.], seq 1695385287, ack 1326303987, win 28960, options [mss 1460,sackOK,TS val 475654562 ecr 2059461,nop,wscale 7], length 0
22:42:26.365180 IP 206.189.113.189.53878 > 142.93.118.186.2749: Flags [.], ack 1, win 229, options [nop,nop,TS val 2059478 ecr 475654562], length 0
22:42:26.365346 IP 142.93.118.186.2749 > 206.189.113.189.53878: Flags [P.], seq 1:26, ack 1, win 227, options [nop,nop,TS val 475654579 ecr 2059478], length 25
22:42:26.433950 IP 206.189.113.189.53878 > 142.93.118.186.2749: Flags [.], ack 26, win 229, options [nop,nop,TS val 2059495 ecr 475654579], length 0
22:42:26.527602 IP 114-47-150-62.dynamic-ip.hinet.net.64434 > 142.93.118.186.microsoft-ds: Flags [S], seq 3279652447, win 8192, options [mss 1440,nop,wscale 2,nop,nop,sackOK], length 0
22:42:26.527647 IP 142.93.118.186.microsoft-ds > 114-47-150-62.dynamic-ip.hinet.net.64434: Flags [R.], seq 0, ack 3279652448, win 0, length 0
22:42:27.225883 IP 114-47-150-62.dynamic-ip.hinet.net.64434 > 142.93.118.186.microsoft-ds: Flags [S], seq 3279652447, win 8192, options [mss 1440,nop,wscale 2,nop,nop,sackOK], length 0
22:42:27.225932 IP 142.93.118.186.microsoft-ds > 114-47-150-62.dynamic-ip.hinet.net.64434: Flags [R.], seq 0, ack 1, win 0, length 0
22:42:27.468599 IP 142.93.118.186.54565 > 67.207.67.2.domain: 357+ A? oracle.com. (28)
22:42:27.468622 IP 142.93.118.186.54565 > 67.207.67.2.domain: 54623+ AAAA? oracle.com. (28)
22:42:27.470340 IP 67.207.67.2.domain > 142.93.118.186.54565: 54623 0/1/0 (93)
22:42:27.471388 IP 67.207.67.2.domain > 142.93.118.186.54565: 357 1/0/0 A 137.254.120.50 (44)
22:42:27.471489 IP 142.93.118.186.36208 > vp-ocoma-cms-adc.oracle.com.http: Flags [S], seq 958308271, win 29200, options [mss 1460,sackOK,TS val 475654856 ecr 0,nop,wscale 7], length 0
22:42:27.515809 IP vp-ocoma-cms-adc.oracle.com.http > 142.93.118.186.36208: Flags [S.], seq 3497819762, ack 958308272, win 4380, options [mss 1460,nop,nop,TS val 2837055526 ecr 475654856,sackOK,eol], length 0
22:42:27.515853 IP 142.93.118.186.36208 > vp-ocoma-cms-adc.oracle.com.http: Flags [.], ack 1, win 29200, options [nop,nop,TS val 475654867 ecr 2837055526], length 0
22:42:27.515933 IP 142.93.118.186.36208 > vp-ocoma-cms-adc.oracle.com.http: Flags [P.], seq 1:138, ack 1, win 29200, options [nop,nop,TS val 475654867 ecr 2837055526], length 137: HTTP: GET / HTTP/1.1
22:42:27.559623 IP vp-ocoma-cms-adc.oracle.com.http > 142.93.118.186.36208: Flags [P.], seq 1:107, ack 138, win 4380, options [nop,nop,TS val 2837055570 ecr 475654867], length 106: HTTP: HTTP/1.0 301 Moved Permanently
22:42:27.559670 IP 142.93.118.186.36208 > vp-ocoma-cms-adc.oracle.com.http: Flags [.], ack 107, win 29200, options [nop,nop,TS val 475654878 ecr 2837055570], length 0
22:42:27.559686 IP vp-ocoma-cms-adc.oracle.com.http > 142.93.118.186.36208: Flags [F.], seq 107, ack 138, win 4517, options [nop,nop,TS val 2837055570 ecr 475654867], length 0
22:42:27.559840 IP 142.93.118.186.36208 > vp-ocoma-cms-adc.oracle.com.http: Flags [F.], seq 138, ack 108, win 29200, options [nop,nop,TS val 475654878 ecr 2837055570], length 0
22:42:27.560069 IP 142.93.118.186.40233 > 67.207.67.2.domain: 32593+ A? www.oracle.com. (32)
22:42:27.560084 IP 142.93.118.186.40233 > 67.207.67.2.domain: 38738+ AAAA? www.oracle.com. (32)
22:42:27.561613 IP 67.207.67.2.domain > 142.93.118.186.40233: 32593 3/0/0 CNAME ds-www.oracle.com.edgekey.net., CNAME e870.dscx.akamaiedge.net., A 23.193.182.108 (126)
22:42:27.561895 IP 67.207.67.2.domain > 142.93.118.186.40233: 38738 4/0/0 CNAME ds-www.oracle.com.edgekey.net., CNAME e870.dscx.akamaiedge.net., AAAA 2600:1400:d:18e::366, AAAA 2600:1400:d:183::366 (166)
22:42:27.562192 IP 142.93.118.186.54678 > a23-193-182-108.deploy.static.akamaitechnologies.com.http: Flags [S], seq 1526867399, win 29200, options [mss 1460,sackOK,TS val 475654879 ecr 0,nop,wscale 7], length 0
22:42:27.562911 IP a23-193-182-108.deploy.static.akamaitechnologies.com.http > 142.93.118.186.54678: Flags [S.], seq 84963278, ack 1526867400, win 28960, options [mss 1460,sackOK,TS val 4129479675 ecr 475654879,nop,wscale 7], length 0
22:42:27.562939 IP 142.93.118.186.54678 > a23-193-182-108.deploy.static.akamaitechnologies.com.http: Flags [.], ack 1, win 229, options [nop,nop,TS val 475654879 ecr 4129479675], length 0
22:42:27.562985 IP 142.93.118.186.54678 > a23-193-182-108.deploy.static.akamaitechnologies.com.http: Flags [P.], seq 1:142, ack 1, win 229, options [nop,nop,TS val 475654879 ecr 4129479675], length 141: HTTP: GET / HTTP/1.1
22:42:27.563729 IP a23-193-182-108.deploy.static.akamaitechnologies.com.http > 142.93.118.186.54678: Flags [.], ack 142, win 235, options [nop,nop,TS val 4129479675 ecr 475654879], length 0
22:42:27.568627 IP a23-193-182-108.deploy.static.akamaitechnologies.com.http > 142.93.118.186.54678: Flags [P.], seq 1:283, ack 142, win 235, options [nop,nop,TS val 4129479680 ecr 475654879], length 282: HTTP: HTTP/1.1 301 Moved Permanently
22:42:27.568657 IP 142.93.118.186.54678 > a23-193-182-108.deploy.static.akamaitechnologies.com.http: Flags [.], ack 283, win 237, options [nop,nop,TS val 475654880 ecr 4129479680], length 0
22:42:27.571217 IP 142.93.118.186.48730 > a23-193-182-108.deploy.static.akamaitechnologies.com.https: Flags [S], seq 655244564, win 29200, options [mss 1460,sackOK,TS val 475654881 ecr 0,nop,wscale 7], length 0
22:42:27.571880 IP a23-193-182-108.deploy.static.akamaitechnologies.com.https > 142.93.118.186.48730: Flags [S.], seq 1167804540, ack 655244565, win 28960, options [mss 1460,sackOK,TS val 1974339688 ecr 475654881,nop,wscale 7], length 0
22:42:27.571901 IP 142.93.118.186.48730 > a23-193-182-108.deploy.static.akamaitechnologies.com.https: Flags [.], ack 1, win 229, options [nop,nop,TS val 475654881 ecr 1974339688], length 0
22:42:27.572021 IP 142.93.118.186.48730 > a23-193-182-108.deploy.static.akamaitechnologies.com.https: Flags [P.], seq 1:329, ack 1, win 229, options [nop,nop,TS val 475654881 ecr 1974339688], length 328
22:42:27.572629 IP a23-193-182-108.deploy.static.akamaitechnologies.com.https > 142.93.118.186.48730: Flags [.], ack 329, win 235, options [nop,nop,TS val 1974339688 ecr 475654881], length 0
22:42:27.573856 IP a23-193-182-108.deploy.static.akamaitechnologies.com.https > 142.93.118.186.48730: Flags [P.], seq 1:2641, ack 329, win 235, options [nop,nop,TS val 1974339689 ecr 475654881], length 2640
22:42:27.573877 IP 142.93.118.186.48730 > a23-193-182-108.deploy.static.akamaitechnologies.com.https: Flags [.], ack 2641, win 270, options [nop,nop,TS val 475654882 ecr 1974339689], length 0
22:42:27.576220 IP 142.93.118.186.48730 > a23-193-182-108.deploy.static.akamaitechnologies.com.https: Flags [P.], seq 329:455, ack 2641, win 270, options [nop,nop,TS val 475654882 ecr 1974339689], length 126
22:42:27.577172 IP a23-193-182-108.deploy.static.akamaitechnologies.com.https > 142.93.118.186.48730: Flags [P.], seq 2641:2883, ack 455, win 235, options [nop,nop,TS val 1974339693 ecr 475654882], length 242
22:42:27.577291 IP 142.93.118.186.48730 > a23-193-182-108.deploy.static.akamaitechnologies.com.https: Flags [P.], seq 455:635, ack 2883, win 292, options [nop,nop,TS val 475654882 ecr 1974339693], length 180
22:42:27.584942 IP a23-193-182-108.deploy.static.akamaitechnologies.com.https > 142.93.118.186.48730: Flags [.], seq 2883:8675, ack 635, win 243, options [nop,nop,TS val 1974339701 ecr 475654882], length 5792
22:42:27.584981 IP 142.93.118.186.48730 > a23-193-182-108.deploy.static.akamaitechnologies.com.https: Flags [.], ack 8675, win 383, options [nop,nop,TS val 475654884 ecr 1974339701], length 0
22:42:27.584991 IP a23-193-182-108.deploy.static.akamaitechnologies.com.https > 142.93.118.186.48730: Flags [.], seq 8675:15915, ack 635, win 243, options [nop,nop,TS val 1974339701 ecr 475654882], length 7240
22:42:27.585007 IP 142.93.118.186.48730 > a23-193-182-108.deploy.static.akamaitechnologies.com.https: Flags [.], ack 15915, win 496, options [nop,nop,TS val 475654884 ecr 1974339701], length 0
22:42:27.585013 IP a23-193-182-108.deploy.static.akamaitechnologies.com.https > 142.93.118.186.48730: Flags [P.], seq 15915:19296, ack 635, win 243, options [nop,nop,TS val 1974339701 ecr 475654882], length 3381
22:42:27.585023 IP 142.93.118.186.48730 > a23-193-182-108.deploy.static.akamaitechnologies.com.https: Flags [.], ack 19296, win 549, options [nop,nop,TS val 475654884 ecr 1974339701], length 0
22:42:27.585029 IP a23-193-182-108.deploy.static.akamaitechnologies.com.https > 142.93.118.186.48730: Flags [.], seq 19296:22192, ack 635, win 243, options [nop,nop,TS val 1974339701 ecr 475654882], length 2896
22:42:27.585034 IP 142.93.118.186.48730 > a23-193-182-108.deploy.static.akamaitechnologies.com.https: Flags [.], ack 22192, win 594, options [nop,nop,TS val 475654884 ecr 1974339701], length 0
22:42:27.585045 IP a23-193-182-108.deploy.static.akamaitechnologies.com.https > 142.93.118.186.48730: Flags [.], seq 22192:25088, ack 635, win 243, options [nop,nop,TS val 1974339701 ecr 475654882], length 2896
22:42:27.585051 IP 142.93.118.186.48730 > a23-193-182-108.deploy.static.akamaitechnologies.com.https: Flags [.], ack 25088, win 639, options [nop,nop,TS val 475654884 ecr 1974339701], length 0
22:42:27.585166 IP 142.93.118.186.54678 > a23-193-182-108.deploy.static.akamaitechnologies.com.http: Flags [F.], seq 142, ack 283, win 237, options [nop,nop,TS val 475654884 ecr 4129479680], length 0
22:42:27.585699 IP a23-193-182-108.deploy.static.akamaitechnologies.com.https > 142.93.118.186.48730: Flags [.], seq 26536:29432, ack 635, win 243, options [nop,nop,TS val 1974339701 ecr 475654884], length 2896
22:42:27.585722 IP a23-193-182-108.deploy.static.akamaitechnologies.com.https > 142.93.118.186.48730: Flags [.], seq 25088:26536, ack 635, win 243, options [nop,nop,TS val 1974339701 ecr 475654884], length 1448
22:42:27.585726 IP a23-193-182-108.deploy.static.akamaitechnologies.com.https > 142.93.118.186.48730: Flags [.], seq 30880:33776, ack 635, win 243, options [nop,nop,TS val 1974339701 ecr 475654884], length 2896
22:42:27.585732 IP a23-193-182-108.deploy.static.akamaitechnologies.com.https > 142.93.118.186.48730: Flags [.], seq 29432:30880, ack 635, win 243, options [nop,nop,TS val 1974339701 ecr 475654884], length 1448
22:42:27.585736 IP a23-193-182-108.deploy.static.akamaitechnologies.com.https > 142.93.118.186.48730: Flags [.], seq 35224:38120, ack 635, win 243, options [nop,nop,TS val 1974339701 ecr 475654884], length 2896
22:42:27.585740 IP a23-193-182-108.deploy.static.akamaitechnologies.com.https > 142.93.118.186.48730: Flags [.], seq 38120:41016, ack 635, win 243, options [nop,nop,TS val 1974339701 ecr 475654884], length 2896
22:42:27.585744 IP a23-193-182-108.deploy.static.akamaitechnologies.com.https > 142.93.118.186.48730: Flags [.], seq 33776:35224, ack 635, win 243, options [nop,nop,TS val 1974339701 ecr 475654884], length 1448
22:42:27.585765 IP a23-193-182-108.deploy.static.akamaitechnologies.com.https > 142.93.118.186.48730: Flags [.], seq 41016:43912, ack 635, win 243, options [nop,nop,TS val 1974339701 ecr 475654884], length 2896
22:42:27.585781 IP a23-193-182-108.deploy.static.akamaitechnologies.com.https > 142.93.118.186.48730: Flags [.], seq 43912:46808, ack 635, win 243, options [nop,nop,TS val 1974339701 ecr 475654884], length 2896
22:42:27.585800 IP 142.93.118.186.48730 > a23-193-182-108.deploy.static.akamaitechnologies.com.https: Flags [.], ack 25088, win 685, options [nop,nop,TS val 475654885 ecr 1974339701,nop,nop,sack 1 {26536:29432}], length 0
22:42:27.585820 IP a23-193-182-108.deploy.static.akamaitechnologies.com.https > 142.93.118.186.48730: Flags [P.], seq 46808:48000, ack 635, win 243, options [nop,nop,TS val 1974339701 ecr 475654884], length 1192
22:42:27.585829 IP 142.93.118.186.48730 > a23-193-182-108.deploy.static.akamaitechnologies.com.https: Flags [.], ack 29432, win 707, options [nop,nop,TS val 475654885 ecr 1974339701], length 0
22:42:27.585837 IP 142.93.118.186.48730 > a23-193-182-108.deploy.static.akamaitechnologies.com.https: Flags [.], ack 29432, win 753, options [nop,nop,TS val 475654885 ecr 1974339701,nop,nop,sack 1 {30880:33776}], length 0
22:42:27.585842 IP 142.93.118.186.48730 > a23-193-182-108.deploy.static.akamaitechnologies.com.https: Flags [.], ack 33776, win 775, options [nop,nop,TS val 475654885 ecr 1974339701], length 0
22:42:27.585850 IP 142.93.118.186.48730 > a23-193-182-108.deploy.static.akamaitechnologies.com.https: Flags [.], ack 33776, win 820, options [nop,nop,TS val 475654885 ecr 1974339701,nop,nop,sack 1 {35224:38120}], length 0
22:42:27.585854 IP 142.93.118.186.48730 > a23-193-182-108.deploy.static.akamaitechnologies.com.https: Flags [.], ack 33776, win 866, options [nop,nop,TS val 475654885 ecr 1974339701,nop,nop,sack 1 {35224:41016}], length 0
22:42:27.585858 IP 142.93.118.186.48730 > a23-193-182-108.deploy.static.akamaitechnologies.com.https: Flags [.], ack 41016, win 888, options [nop,nop,TS val 475654885 ecr 1974339701], length 0
22:42:27.585862 IP 142.93.118.186.48730 > a23-193-182-108.deploy.static.akamaitechnologies.com.https: Flags [.], ack 43912, win 934, options [nop,nop,TS val 475654885 ecr 1974339701], length 0
22:42:27.585865 IP 142.93.118.186.48730 > a23-193-182-108.deploy.static.akamaitechnologies.com.https: Flags [.], ack 46808, win 979, options [nop,nop,TS val 475654885 ecr 1974339701], length 0
22:42:27.585868 IP a23-193-182-108.deploy.static.akamaitechnologies.com.http > 142.93.118.186.54678: Flags [F.], seq 283, ack 143, win 235, options [nop,nop,TS val 4129479698 ecr 475654884], length 0
22:42:27.585878 IP 142.93.118.186.54678 > a23-193-182-108.deploy.static.akamaitechnologies.com.http: Flags [.], ack 284, win 237, options [nop,nop,TS val 475654885 ecr 4129479698], length 0
22:42:27.585893 IP 142.93.118.186.48730 > a23-193-182-108.deploy.static.akamaitechnologies.com.https: Flags [.], ack 48000, win 1001, options [nop,nop,TS val 475654885 ecr 1974339701], length 0
22:42:27.586523 IP 142.93.118.186.48730 > a23-193-182-108.deploy.static.akamaitechnologies.com.https: Flags [F.], seq 635, ack 48000, win 1001, options [nop,nop,TS val 475654885 ecr 1974339701], length 0
22:42:27.586801 IP a23-193-182-108.deploy.static.akamaitechnologies.com.https > 142.93.118.186.48730: Flags [.], seq 33776:35224, ack 635, win 243, options [nop,nop,TS val 1974339702 ecr 475654885], length 1448
22:42:27.586815 IP 142.93.118.186.48730 > a23-193-182-108.deploy.static.akamaitechnologies.com.https: Flags [.], ack 48000, win 1001, options [nop,nop,TS val 475654885 ecr 1974339701,nop,nop,sack 1 {33776:35224}], length 0
22:42:27.587722 IP a23-193-182-108.deploy.static.akamaitechnologies.com.https > 142.93.118.186.48730: Flags [P.], seq 48000:48031, ack 636, win 243, options [nop,nop,TS val 1974339703 ecr 475654885], length 31
22:42:27.587750 IP 142.93.118.186.48730 > a23-193-182-108.deploy.static.akamaitechnologies.com.https: Flags [R], seq 655245200, win 0, length 0
22:42:27.587763 IP a23-193-182-108.deploy.static.akamaitechnologies.com.https > 142.93.118.186.48730: Flags [F.], seq 48031, ack 636, win 243, options [nop,nop,TS val 1974339703 ecr 475654885], length 0
22:42:27.587770 IP 142.93.118.186.48730 > a23-193-182-108.deploy.static.akamaitechnologies.com.https: Flags [R], seq 655245200, win 0, length 0
22:42:27.603519 IP vp-ocoma-cms-adc.oracle.com.http > 142.93.118.186.36208: Flags [.], ack 139, win 4517, options [nop,nop,TS val 2837055614 ecr 475654878], length 0
22:42:31.193852 IP 206.189.113.189.53878 > 142.93.118.186.2749: Flags [P.], seq 1:14, ack 26, win 229, options [nop,nop,TS val 2060685 ecr 475654579], length 13
22:42:31.193898 IP 142.93.118.186.2749 > 206.189.113.189.53878: Flags [.], ack 14, win 227, options [nop,nop,TS val 475655787 ecr 2060685], length 0
22:42:31.194015 IP 142.93.118.186.2749 > 206.189.113.189.53878: Flags [P.], seq 26:69, ack 14, win 227, options [nop,nop,TS val 475655787 ecr 2060685], length 43
22:42:31.194040 IP 142.93.118.186.2749 > 104.248.224.85.33794: Flags [P.], seq 65:103, ack 10, win 227, options [nop,nop,TS val 475655787 ecr 2074906], length 38
22:42:31.194460 IP 104.248.224.85.33794 > 142.93.118.186.2749: Flags [.], ack 103, win 229, options [nop,nop,TS val 2076493 ecr 475655787], length 0
22:42:31.262537 IP 206.189.113.189.53878 > 142.93.118.186.2749: Flags [.], ack 69, win 229, options [nop,nop,TS val 2060702 ecr 475655787], length 0
22:42:33.595467 IP 142.93.118.186.52622 > 67.207.67.2.domain: 52606+ A? microsoft.com. (31)
22:42:33.596059 IP 67.207.67.2.domain > 142.93.118.186.52622: 52606 5/0/0 A 40.113.200.201, A 13.77.161.179, A 104.215.148.63, A 40.76.4.15, A 40.112.72.205 (111)
22:42:33.598830 IP 142.93.118.186.58408 > 67.207.67.2.domain: 22877+ A? csec.umd.edu. (30)
22:42:33.598853 IP 142.93.118.186.58408 > 67.207.67.2.domain: 63823+ AAAA? csec.umd.edu. (30)
22:42:33.599424 IP 67.207.67.2.domain > 142.93.118.186.58408: 22877 2/0/0 CNAME csec.umiacs.umd.edu., A 128.8.120.43 (72)
22:42:33.616001 IP 67.207.67.2.domain > 142.93.118.186.58408: 63823 1/1/0 CNAME csec.umiacs.umd.edu. (112)
22:42:33.616214 IP 142.93.118.186.35020 > csec-vip.umiacs.umd.edu.http: Flags [S], seq 1047921896, win 29200, options [mss 1460,sackOK,TS val 475656392 ecr 0,nop,wscale 7], length 0
22:42:33.626185 IP csec-vip.umiacs.umd.edu.http > 142.93.118.186.35020: Flags [S.], seq 1915146468, ack 1047921897, win 28960, options [mss 1460,sackOK,TS val 526654804 ecr 475656392,nop,wscale 7], length 0
22:42:33.626235 IP 142.93.118.186.35020 > csec-vip.umiacs.umd.edu.http: Flags [.], ack 1, win 229, options [nop,nop,TS val 475656395 ecr 526654804], length 0
22:42:33.626322 IP 142.93.118.186.35020 > csec-vip.umiacs.umd.edu.http: Flags [P.], seq 1:140, ack 1, win 229, options [nop,nop,TS val 475656395 ecr 526654804], length 139: HTTP: GET / HTTP/1.1
22:42:33.643501 IP csec-vip.umiacs.umd.edu.http > 142.93.118.186.35020: Flags [.], seq 1:4345, ack 140, win 235, options [nop,nop,TS val 526654817 ecr 475656395], length 4344: HTTP: HTTP/1.1 200 OK
22:42:33.643543 IP 142.93.118.186.35020 > csec-vip.umiacs.umd.edu.http: Flags [.], ack 4345, win 296, options [nop,nop,TS val 475656399 ecr 526654817], length 0
22:42:33.643554 IP csec-vip.umiacs.umd.edu.http > 142.93.118.186.35020: Flags [.], seq 4345:13033, ack 140, win 235, options [nop,nop,TS val 526654817 ecr 475656395], length 8688: HTTP
22:42:33.643563 IP 142.93.118.186.35020 > csec-vip.umiacs.umd.edu.http: Flags [.], ack 13033, win 432, options [nop,nop,TS val 475656399 ecr 526654817], length 0
22:42:33.653466 IP csec-vip.umiacs.umd.edu.http > 142.93.118.186.35020: Flags [P.], seq 13033:16317, ack 140, win 235, options [nop,nop,TS val 526654831 ecr 475656399], length 3284: HTTP
22:42:33.653505 IP 142.93.118.186.35020 > csec-vip.umiacs.umd.edu.http: Flags [.], ack 16317, win 484, options [nop,nop,TS val 475656401 ecr 526654831], length 0
22:42:33.654067 IP 142.93.118.186.35020 > csec-vip.umiacs.umd.edu.http: Flags [F.], seq 140, ack 16317, win 484, options [nop,nop,TS val 475656402 ecr 526654831], length 0
22:42:33.663429 IP csec-vip.umiacs.umd.edu.http > 142.93.118.186.35020: Flags [F.], seq 16317, ack 141, win 235, options [nop,nop,TS val 526654841 ecr 475656402], length 0
22:42:33.663471 IP 142.93.118.186.35020 > csec-vip.umiacs.umd.edu.http: Flags [.], ack 16318, win 484, options [nop,nop,TS val 475656404 ecr 526654841], length 0
22:42:35.365611 IP 104.248.224.85.33794 > 142.93.118.186.2749: Flags [P.], seq 10:34, ack 103, win 229, options [nop,nop,TS val 2077536 ecr 475655787], length 24
22:42:35.365737 IP 142.93.118.186.2749 > 206.189.113.189.53878: Flags [P.], seq 69:105, ack 14, win 227, options [nop,nop,TS val 475656830 ecr 2060702], length 36
22:42:35.401707 IP 142.93.118.186.2749 > 104.248.224.85.33794: Flags [.], ack 34, win 227, options [nop,nop,TS val 475656839 ecr 2077536], length 0
22:42:35.434387 IP 206.189.113.189.53878 > 142.93.118.186.2749: Flags [.], ack 105, win 229, options [nop,nop,TS val 2061745 ecr 475656830], length 0
22:42:39.655823 IP 142.93.118.186.45738 > 67.207.67.2.domain: 46403+ A? csec.umd.edu. (30)
22:42:39.655845 IP 142.93.118.186.45738 > 67.207.67.2.domain: 32540+ AAAA? csec.umd.edu. (30)
22:42:39.656322 IP 67.207.67.2.domain > 142.93.118.186.45738: 46403 2/0/0 CNAME csec.umiacs.umd.edu., A 128.8.120.43 (72)
22:42:39.672093 IP 67.207.67.2.domain > 142.93.118.186.45738: 32540 1/1/0 CNAME csec.umiacs.umd.edu. (112)
22:42:39.672312 IP 142.93.118.186.49601 > csec-vip.umiacs.umd.edu.33434: UDP, length 32
22:42:39.672366 IP 142.93.118.186.46852 > csec-vip.umiacs.umd.edu.33435: UDP, length 32
22:42:39.672386 IP 142.93.118.186.36769 > csec-vip.umiacs.umd.edu.33436: UDP, length 32
22:42:39.672404 IP 142.93.118.186.35210 > csec-vip.umiacs.umd.edu.33437: UDP, length 32
22:42:39.672422 IP 142.93.118.186.59866 > csec-vip.umiacs.umd.edu.33438: UDP, length 32
22:42:39.672439 IP 142.93.118.186.37043 > csec-vip.umiacs.umd.edu.33439: UDP, length 32
22:42:39.672456 IP 142.93.118.186.33986 > csec-vip.umiacs.umd.edu.33440: UDP, length 32
22:42:39.672473 IP 142.93.118.186.38063 > csec-vip.umiacs.umd.edu.33441: UDP, length 32
22:42:39.672500 IP 142.93.118.186.37968 > csec-vip.umiacs.umd.edu.33442: UDP, length 32
22:42:39.672517 IP 142.93.118.186.53937 > csec-vip.umiacs.umd.edu.33443: UDP, length 32
22:42:39.672536 IP 142.93.118.186.60718 > csec-vip.umiacs.umd.edu.33444: UDP, length 32
22:42:39.672561 IP 142.93.118.186.42898 > csec-vip.umiacs.umd.edu.33445: UDP, length 32
22:42:39.672589 IP 142.93.118.186.44570 > csec-vip.umiacs.umd.edu.33446: UDP, length 32
22:42:39.672614 IP 142.93.118.186.33785 > csec-vip.umiacs.umd.edu.33447: UDP, length 32
22:42:39.672749 IP 142.93.118.186.50480 > csec-vip.umiacs.umd.edu.33448: UDP, length 32
22:42:39.672769 IP 142.93.118.186.33325 > csec-vip.umiacs.umd.edu.33449: UDP, length 32
22:42:39.673359 IP 138.197.251.84 > 142.93.118.186: ICMP time exceeded in-transit, length 36
22:42:39.673378 IP 142.93.112.253 > 142.93.118.186: ICMP time exceeded in-transit, length 36
22:42:39.673383 IP 138.197.251.84 > 142.93.118.186: ICMP time exceeded in-transit, length 36
22:42:39.673390 IP 142.93.112.253 > 142.93.118.186: ICMP time exceeded in-transit, length 36
22:42:39.673453 IP 142.93.112.253 > 142.93.118.186: ICMP time exceeded in-transit, length 36
22:42:39.673551 IP 142.93.118.186.34043 > 67.207.67.2.domain: 56235+ PTR? 253.112.93.142.in-addr.arpa. (45)
22:42:39.674083 IP 67.207.67.2.domain > 142.93.118.186.34043: 56235 NXDomain 0/1/0 (112)
22:42:39.674172 IP 138.197.251.64 > 142.93.118.186: ICMP time exceeded in-transit, length 36
22:42:39.674202 IP 142.93.118.186.45367 > csec-vip.umiacs.umd.edu.33450: UDP, length 32
22:42:39.674264 IP 142.93.118.186.36061 > csec-vip.umiacs.umd.edu.33451: UDP, length 32
22:42:39.674291 IP 142.93.118.186.40343 > csec-vip.umiacs.umd.edu.33452: UDP, length 32
22:42:39.674313 IP 142.93.118.186.38644 > csec-vip.umiacs.umd.edu.33453: UDP, length 32
22:42:39.674424 IP 142.93.118.186.46049 > 67.207.67.2.domain: 45526+ PTR? 64.251.197.138.in-addr.arpa. (45)
22:42:39.674882 IP 67.207.67.2.domain > 142.93.118.186.46049: 45526 NXDomain 0/1/0 (112)
22:42:39.674989 IP 142.93.118.186.32909 > 67.207.67.2.domain: 38870+ PTR? 84.251.197.138.in-addr.arpa. (45)
22:42:39.679938 IP 67.207.67.2.domain > 142.93.118.186.32909: 38870 NXDomain 0/1/0 (112)
22:42:39.680021 IP 142.93.118.186.44887 > csec-vip.umiacs.umd.edu.33454: UDP, length 32
22:42:39.680040 IP 142.93.118.186.52578 > csec-vip.umiacs.umd.edu.33455: UDP, length 32
22:42:39.681004 IP MID-ATLANTI.ear2.Washington1.Level3.net > 142.93.118.186: ICMP time exceeded in-transit, length 36
22:42:39.681020 IP MID-ATLANTI.ear2.Washington1.Level3.net > 142.93.118.186: ICMP time exceeded in-transit, length 36
22:42:39.681076 IP MID-ATLANTI.ear2.Washington1.Level3.net > 142.93.118.186: ICMP time exceeded in-transit, length 36
22:42:39.681097 IP 142.93.118.186.47148 > csec-vip.umiacs.umd.edu.33456: UDP, length 32
22:42:39.681116 IP 142.93.118.186.53213 > csec-vip.umiacs.umd.edu.33457: UDP, length 32
22:42:39.681136 IP 142.93.118.186.46050 > csec-vip.umiacs.umd.edu.33458: UDP, length 32
22:42:39.682189 IP ae0.clpk-core.maxgigapop.net > 142.93.118.186: ICMP time exceeded in-transit, length 148
22:42:39.682230 IP 142.93.118.186.50106 > csec-vip.umiacs.umd.edu.33459: UDP, length 32
22:42:39.683506 IP umd-isp.clpk.demarc.maxgigapop.net > 142.93.118.186: ICMP time exceeded in-transit, length 76
22:42:39.683544 IP ae0.clpk-core.maxgigapop.net > 142.93.118.186: ICMP time exceeded in-transit, length 148
22:42:39.683568 IP 142.93.118.186.52479 > csec-vip.umiacs.umd.edu.33460: UDP, length 32
22:42:39.683592 IP 142.93.118.186.43365 > csec-vip.umiacs.umd.edu.33461: UDP, length 32
22:42:39.683817 IP ae0.clpk-core.maxgigapop.net > 142.93.118.186: ICMP time exceeded in-transit, length 148
22:42:39.683842 IP 142.93.118.186.49106 > csec-vip.umiacs.umd.edu.33462: UDP, length 32
22:42:39.683926 IP umd-isp.clpk.demarc.maxgigapop.net > 142.93.118.186: ICMP time exceeded in-transit, length 76
22:42:39.683949 IP 142.93.118.186.50460 > csec-vip.umiacs.umd.edu.33463: UDP, length 32
22:42:39.689699 IP umd-isp.clpk.demarc.maxgigapop.net > 142.93.118.186: ICMP time exceeded in-transit, length 76
22:42:39.689787 IP 142.93.118.186.55372 > csec-vip.umiacs.umd.edu.33464: UDP, length 32
22:42:39.690388 IP 128.8.0.12 > 142.93.118.186: ICMP time exceeded in-transit, length 36
22:42:39.690424 IP 142.93.118.186.36381 > csec-vip.umiacs.umd.edu.33465: UDP, length 32
22:42:39.690649 IP 128.8.0.155 > 142.93.118.186: ICMP time exceeded in-transit, length 36
22:42:39.690709 IP 142.93.118.186.36653 > csec-vip.umiacs.umd.edu.33466: UDP, length 32
22:42:39.691522 IP 128.8.0.12 > 142.93.118.186: ICMP time exceeded in-transit, length 36
22:42:39.691562 IP 142.93.118.186.45271 > csec-vip.umiacs.umd.edu.33467: UDP, length 32
22:42:39.691732 IP 128.8.0.155 > 142.93.118.186: ICMP time exceeded in-transit, length 36
22:42:39.691770 IP 142.93.118.186.41190 > csec-vip.umiacs.umd.edu.33468: UDP, length 32
22:42:39.691853 IP 128.8.0.12 > 142.93.118.186: ICMP time exceeded in-transit, length 36
22:42:39.691882 IP 142.93.118.186.57184 > csec-vip.umiacs.umd.edu.33469: UDP, length 32
22:42:39.693299 IP 128.8.0.155 > 142.93.118.186: ICMP time exceeded in-transit, length 36
22:42:39.693350 IP 142.93.118.186.47115 > csec-vip.umiacs.umd.edu.33470: UDP, length 32
22:42:39.694088 IP 128.8.0.97 > 142.93.118.186: ICMP time exceeded in-transit, length 36
22:42:39.694094 IP 128.8.0.97 > 142.93.118.186: ICMP time exceeded in-transit, length 36
22:42:39.694127 IP 142.93.118.186.36174 > csec-vip.umiacs.umd.edu.33471: UDP, length 32
22:42:39.694146 IP 142.93.118.186.56330 > csec-vip.umiacs.umd.edu.33472: UDP, length 32
22:42:39.694234 IP 128.8.0.97 > 142.93.118.186: ICMP time exceeded in-transit, length 36
22:42:39.694266 IP 142.93.118.186.43330 > csec-vip.umiacs.umd.edu.33473: UDP, length 32
22:42:39.699085 IP 128.8.7.2 > 142.93.118.186: ICMP time exceeded in-transit, length 36
22:42:39.699146 IP 142.93.118.186.57959 > csec-vip.umiacs.umd.edu.33474: UDP, length 32
22:42:39.699442 IP 128.8.7.2 > 142.93.118.186: ICMP time exceeded in-transit, length 36
22:42:39.699480 IP 142.93.118.186.32922 > csec-vip.umiacs.umd.edu.33475: UDP, length 32
22:42:39.700251 IP 128.8.7.2 > 142.93.118.186: ICMP time exceeded in-transit, length 36
22:42:39.700294 IP 142.93.118.186.33394 > csec-vip.umiacs.umd.edu.33476: UDP, length 32
22:42:39.703250 IP csec-vip.umiacs.umd.edu > 142.93.118.186: ICMP host csec-vip.umiacs.umd.edu unreachable - admin prohibited, length 68
22:42:39.703681 IP csec-vip.umiacs.umd.edu > 142.93.118.186: ICMP host csec-vip.umiacs.umd.edu unreachable - admin prohibited, length 68
22:42:39.703874 IP csec-vip.umiacs.umd.edu > 142.93.118.186: ICMP host csec-vip.umiacs.umd.edu unreachable - admin prohibited, length 68
22:42:39.703880 IP csec-vip.umiacs.umd.edu > 142.93.118.186: ICMP host csec-vip.umiacs.umd.edu unreachable - admin prohibited, length 68
22:42:39.708906 IP csec-vip.umiacs.umd.edu > 142.93.118.186: ICMP host csec-vip.umiacs.umd.edu unreachable - admin prohibited, length 68
22:42:39.709323 IP csec-vip.umiacs.umd.edu > 142.93.118.186: ICMP host csec-vip.umiacs.umd.edu unreachable - admin prohibited, length 68
22:42:39.714241 IP v62.avw-1139a.net.umiacs.umd.edu > 142.93.118.186: ICMP time exceeded in-transit, length 36
22:42:39.714660 IP v62.avw-1139a.net.umiacs.umd.edu > 142.93.118.186: ICMP time exceeded in-transit, length 36
22:42:39.714805 IP v62.avw-1139a.net.umiacs.umd.edu > 142.93.118.186: ICMP time exceeded in-transit, length 36
22:42:39.741508 IP 59-115-128-236.dynamic-ip.hinet.net.64699 > 142.93.118.186.microsoft-ds: Flags [S], seq 189597798, win 8192, options [mss 1452,nop,nop,sackOK], length 0
22:42:39.741559 IP 142.93.118.186.microsoft-ds > 59-115-128-236.dynamic-ip.hinet.net.64699: Flags [R.], seq 0, ack 189597799, win 0, length 0
22:42:39.756393 IP 206.189.113.189.53878 > 142.93.118.186.2749: Flags [P.], seq 14:42, ack 105, win 229, options [nop,nop,TS val 2062826 ecr 475656830], length 28
22:42:39.756555 IP 142.93.118.186.2749 > 104.248.224.85.33794: Flags [P.], seq 103:147, ack 34, win 227, options [nop,nop,TS val 475657927 ecr 2077536], length 44
22:42:39.756937 IP 104.248.224.85.33794 > 142.93.118.186.2749: Flags [.], ack 147, win 229, options [nop,nop,TS val 2078634 ecr 475657927], length 0
22:42:39.793708 IP 142.93.118.186.2749 > 206.189.113.189.53878: Flags [.], ack 42, win 227, options [nop,nop,TS val 475657937 ecr 2062826], length 0
22:42:40.443424 IP 59-115-128-236.dynamic-ip.hinet.net.64699 > 142.93.118.186.microsoft-ds: Flags [S], seq 189597798, win 8192, options [mss 1452,nop,nop,sackOK], length 0
22:42:40.443478 IP 142.93.118.186.microsoft-ds > 59-115-128-236.dynamic-ip.hinet.net.64699: Flags [R.], seq 0, ack 1, win 0, length 0
22:42:40.852313 IP ae-1-3501.ear2.Washington1.Level3.net > 142.93.118.186: ICMP time exceeded in-transit, length 68
22:42:40.852699 IP ae-1-3501.ear2.Washington1.Level3.net > 142.93.118.186: ICMP time exceeded in-transit, length 68
22:42:40.853236 IP ae-1-3501.ear2.Washington1.Level3.net > 142.93.118.186: ICMP time exceeded in-transit, length 68
22:42:44.676279 IP 142.93.118.186.59027 > 67.207.67.2.domain: 59724+ PTR? 69.206.69.4.in-addr.arpa. (42)
22:42:44.873578 IP 67.207.67.2.domain > 142.93.118.186.59027: 59724 1/0/0 PTR ae-1-3501.ear2.Washington1.Level3.net. (93)
22:42:44.873831 IP 142.93.118.186.56165 > 67.207.67.2.domain: 16362+ PTR? 178.249.16.4.in-addr.arpa. (43)
22:42:44.876332 IP 67.207.67.2.domain > 142.93.118.186.56165: 16362 1/0/0 PTR MID-ATLANTI.ear2.Washington1.Level3.net. (96)
22:42:44.876480 IP 142.93.118.186.39665 > 67.207.67.2.domain: 52129+ PTR? 81.178.196.206.in-addr.arpa. (45)
22:42:44.888619 IP 67.207.67.2.domain > 142.93.118.186.39665: 52129 1/0/0 PTR ae0.clpk-core.maxgigapop.net. (87)
22:42:44.888797 IP 142.93.118.186.47082 > 67.207.67.2.domain: 59755+ PTR? 87.177.196.206.in-addr.arpa. (45)
22:42:44.900590 IP 67.207.67.2.domain > 142.93.118.186.47082: 59755 1/0/0 PTR umd-isp.clpk.demarc.maxgigapop.net. (93)
22:42:44.900786 IP 142.93.118.186.49193 > 67.207.67.2.domain: 57763+ PTR? 12.0.8.128.in-addr.arpa. (41)
22:42:44.912999 IP 67.207.67.2.domain > 142.93.118.186.49193: 57763 NXDomain 0/1/0 (108)
22:42:44.913230 IP 142.93.118.186.59436 > 67.207.67.2.domain: 27533+ PTR? 155.0.8.128.in-addr.arpa. (42)
22:42:44.924879 IP 67.207.67.2.domain > 142.93.118.186.59436: 27533 NXDomain 0/1/0 (109)
22:42:44.925079 IP 142.93.118.186.44240 > 67.207.67.2.domain: 15208+ PTR? 97.0.8.128.in-addr.arpa. (41)
22:42:44.938439 IP 67.207.67.2.domain > 142.93.118.186.44240: 15208 NXDomain 0/1/0 (108)
22:42:44.938677 IP 142.93.118.186.42928 > 67.207.67.2.domain: 64866+ PTR? 2.7.8.128.in-addr.arpa. (40)
22:42:44.951689 IP 67.207.67.2.domain > 142.93.118.186.42928: 64866 NXDomain 0/1/0 (107)
22:42:44.951871 IP 142.93.118.186.57717 > 67.207.67.2.domain: 45986+ PTR? 194.118.8.128.in-addr.arpa. (44)
22:42:45.008058 IP 67.207.67.2.domain > 142.93.118.186.57717: 45986 1/0/0 PTR v62.avw-1139a.net.umiacs.umd.edu. (90)
22:42:45.008323 IP 142.93.118.186.37250 > 67.207.67.2.domain: 30203+ PTR? 43.120.8.128.in-addr.arpa. (43)
22:42:45.052658 IP 67.207.67.2.domain > 142.93.118.186.37250: 30203 1/0/0 PTR csec-vip.umiacs.umd.edu. (80)
22:42:48.486062 IP 104.248.224.85.33794 > 142.93.118.186.2749: Flags [P.], seq 34:69, ack 147, win 229, options [nop,nop,TS val 2080816 ecr 475657927], length 35
22:42:48.486103 IP 142.93.118.186.2749 > 104.248.224.85.33794: Flags [.], ack 69, win 227, options [nop,nop,TS val 475660110 ecr 2080816], length 0
22:42:48.486201 IP 142.93.118.186.2749 > 206.189.113.189.53878: Flags [P.], seq 105:152, ack 42, win 227, options [nop,nop,TS val 475660110 ecr 2062826], length 47
22:42:48.554834 IP 206.189.113.189.53878 > 142.93.118.186.2749: Flags [.], ack 152, win 229, options [nop,nop,TS val 2065025 ecr 475660110], length 0
22:42:52.057009 IP 142.93.118.186.58001 > 67.207.67.2.domain: 44899+ A? cnn.com. (25)
22:42:52.057035 IP 142.93.118.186.58001 > 67.207.67.2.domain: 16218+ AAAA? cnn.com. (25)
22:42:52.057556 IP 67.207.67.2.domain > 142.93.118.186.58001: 16218 4/0/0 AAAA 2a04:4e42::323, AAAA 2a04:4e42:400::323, AAAA 2a04:4e42:600::323, AAAA 2a04:4e42:200::323 (137)
22:42:52.058784 IP 67.207.67.2.domain > 142.93.118.186.58001: 44899 4/0/0 A 151.101.129.67, A 151.101.1.67, A 151.101.193.67, A 151.101.65.67 (89)
22:42:52.059089 IP 142.93.118.186.37996 > 151.101.129.67.http: Flags [S], seq 3111386597, win 29200, options [mss 1460,sackOK,TS val 475661003 ecr 0,nop,wscale 7], length 0
22:42:52.060009 IP 151.101.129.67.http > 142.93.118.186.37996: Flags [S.], seq 706350592, ack 3111386598, win 26960, options [mss 1360,sackOK,TS val 1767848114 ecr 475661003,nop,wscale 9], length 0
22:42:52.060054 IP 142.93.118.186.37996 > 151.101.129.67.http: Flags [.], ack 1, win 229, options [nop,nop,TS val 475661003 ecr 1767848114], length 0
22:42:52.060095 IP 142.93.118.186.37996 > 151.101.129.67.http: Flags [P.], seq 1:135, ack 1, win 229, options [nop,nop,TS val 475661003 ecr 1767848114], length 134: HTTP: GET / HTTP/1.1
22:42:52.060502 IP 151.101.129.67.http > 142.93.118.186.37996: Flags [.], ack 135, win 55, options [nop,nop,TS val 1767848115 ecr 475661003], length 0
22:42:52.060675 IP 151.101.129.67.http > 142.93.118.186.37996: Flags [P.], seq 1:436, ack 135, win 55, options [nop,nop,TS val 1767848115 ecr 475661003], length 435: HTTP: HTTP/1.1 301 Moved Permanently
22:42:52.060700 IP 142.93.118.186.37996 > 151.101.129.67.http: Flags [.], ack 436, win 237, options [nop,nop,TS val 475661003 ecr 1767848115], length 0
22:42:52.060788 IP 151.101.129.67.http > 142.93.118.186.37996: Flags [F.], seq 436, ack 135, win 55, options [nop,nop,TS val 1767848115 ecr 475661003], length 0
22:42:52.060814 IP 142.93.118.186.37996 > 151.101.129.67.http: Flags [F.], seq 135, ack 437, win 237, options [nop,nop,TS val 475661003 ecr 1767848115], length 0
22:42:52.060925 IP 142.93.118.186.35875 > 67.207.67.2.domain: 38306+ A? www.cnn.com. (29)
22:42:52.060934 IP 142.93.118.186.35875 > 67.207.67.2.domain: 8689+ AAAA? www.cnn.com. (29)
22:42:52.061254 IP 151.101.129.67.http > 142.93.118.186.37996: Flags [.], ack 136, win 55, options [nop,nop,TS val 1767848115 ecr 475661003], length 0
22:42:52.061471 IP 67.207.67.2.domain > 142.93.118.186.35875: 38306 2/0/0 CNAME turner-tls.map.fastly.net., A 151.101.21.67 (84)
22:42:52.061493 IP 67.207.67.2.domain > 142.93.118.186.35875: 8689 2/0/0 CNAME turner-tls.map.fastly.net., AAAA 2a04:4e42:5::323 (96)
22:42:52.061671 IP 142.93.118.186.40880 > 151.101.21.67.http: Flags [S], seq 1916649283, win 29200, options [mss 1460,sackOK,TS val 475661003 ecr 0,nop,wscale 7], length 0
22:42:52.062112 IP 151.101.21.67.http > 142.93.118.186.40880: Flags [S.], seq 3636459010, ack 1916649284, win 26960, options [mss 1360,sackOK,TS val 1635219212 ecr 475661003,nop,wscale 9], length 0
